,title,label
604,서울게임아카데미 한정된 자원으로 만드는 게임일수록 일관성 중요,0
605,코로나 블루 스트레스 매운맛으로 타파 대한민국은 지금 매운맛 열풍 속,1
606,아가 입맛도 먹을 수 있는 엽떡초보맛 출시됐다,1
607,코로나 블루 스트레스 매운맛으로 타파 대한민국은 지금 매운맛 열풍 속,1
608,스코빌 지수 대신 매운맛 기준이 된 대표 음식 3가지,0
609,대한민국 외식 프랜차이즈는 지금 매운맛 열풍 업계 매운맛 진제품 지속적 출,1
610,집에서도 넓적당면 간편하게식품·외식업계 식감 전쟁,0
611,리뷰프로젝트 모름 셔터냥 사진 찍는 고양이와 1만 스코빌 매운 맛의 조,0
612,특제소스 특별한 매운 맛 혼밥족 한끼 해결사,0
613,안락2동 설 명절맞이 어려운 이웃에게 온정의 손길 이어져 外,0
614,소대장님도 보고있다 샤이니 키기범이의 컴백을 신고합니다 ft창섭,0
615,대한민국 외식 프랜차이즈는 지금 매운맛 열풍 업계 매운맛 제품 지속적 출시,1
616,각양각색 커스텀 케이크 전성시대,0
617,속 뒤집어지는 화끈한 엽떡과 케미 폭발하는 음식 5,0
618,비건 간편식→홈술 안주 코로나19에 다양성 확장한 집콕 메뉴,0
619,헬스장 영업 정지 당하고 홧김에 난생 처음 엽떡 시켜 먹은 헬스 유튜버,0
620,비바100 창업비 2000만원 이하 불닭발·김가네 연매출 3억 훌쩍,0
621,생활경제 알쓸신잡 음식 배달앱도 성향따라 다르다 나에게 맞은 앱을 찾아,0
622,집에서도 맛있게 즐길 수 있는 집콕 메뉴’,0
623,치느님’과 환상궁합은 먹방 유튜버들이 사랑한 치킨과 사이드메뉴,0
624,외식업계 치즈 치즈 치즈신제품 키워드는 치즈,1
625,치즈 많을수록 맛있다 끊기지 않는 치즈 열풍,1
626,이열치열’에 어울리는 음식은,0
627,분식 차세대 K푸드로 뜬다,0
628,채널A 먹거리X파일’ 이번엔 썩은 마늘’ 과잉보도 논란,-1
629,배달도 위험” 쿠팡·마켓컬리 직원 코로나 확진에 소비자 불안 커져,0
630,배달도 위험” 쿠팡·마켓컬리 직원 코로나 확진에 소비자 불안 커져,0
631,삼성서울병원 접촉자 모두 음성수술장 재개,0
632,분식 싸다고 우습게 보지마,0
633,남자 1인 소자본창업 아이템 쭈꾸미도사 이색메뉴 대창쭈꾸미로 인기몰이,1
634,외국인이 좋아하는 한국음식은,0
635,Trend 치즈 없는 외식업계는 단팥 없는 붕어빵,0
636,문가영 엑소랑 드라마 찍더니 얼굴이반짝반짝 빛나는 셀카’,0
637,우리 옆집에 엑소가 산다’ 문가영 셀카 공개귀요미 표정 ’사랑스러워,0
638,미국에서 귀국한 뒤 마트 돌아다니고 엽떡 사먹으러 간 서초구 코로나 확진,0
639,다이어트 도시락으로 일주일 만에 3Kg 감량 가능,0
640,우리 옆집에 엑소가 산다’ 문가영 셀카 공개귀요미 표정 ’사랑스러워,0
641,미국에서 귀국한 뒤 마트 돌아다니고 엽떡 사먹으러 간 서초구 코로나 확진,0
642,다이어트 도시락으로 일주일 만에 3Kg 감량 가능,0
643,한국인이 사랑하는 야식 BEST,0
644,야식 소비 급증 매운 야식 열전,0
645,요식업계 태플릿PC 메뉴판 도입,0
646,집에서도 지루하지 않은 홈푸드 추천,0
647,마포구 6번 확진자 발생 타 지역 확진자 구내 동선도 공개,0
648,꾸덕한 크림치즈 때려 넣어 엽떡과 환상궁합이라 난리난 신상 바삭치즈만두,1
649,랜선라이프 밴쯔 짜장면떡볶이 컬래버입맛 돋구는 엽기짜장 탄생종합,0
650,마포구 6번 확진자 발생 타 지역 확진자 구내 동선도 공개,0
651,꾸덕한 크림치즈 때려 넣어 엽떡과 환상궁합이라 난리난 신상 바삭치즈만두,1
652,랜선라이프 밴쯔 짜장면떡볶이 컬래버입맛 돋구는 엽기짜장 탄생종합,0
653,다온플러스 친환경 수제 비누로 2021 대한민국을 빛낼 인물기업기관·,0
654,한국 매운음식 5 선정 짬뽕 불닭마저도 무릎꿇은 공포의 음식은,0
655,은진테크 미닫이창 틈새 봉쇄 제품으로 2021 대한민국을 빛낼 인물기업기,0
656,중국 사리’ 한국인의 입맛을 사로잡다,0
657,수험표 들고 오면 메뉴 반값”외식업계 수험생 이벤트 시작됐다,0
658,열심히 공부한 당신 먹어라 외식업계 수험생 이벤트 활발,0
659,수험표 들고와서 외식하세요” 외식업계 수험생 모시기’ 본격 돌입,0
660,수험표 들고 여기서 외식하세요” 외식업계 수험생 이벤트 활발,0
661,수험생에게 쏩니다 유통업계 수험생 공략 이벤트 풍성,0
662,수험표 가져오면 할인이 팍팍,0
663,카드뉴스 영화관 테마파크 외식업계 쇼핑 등 2020학년도 수험생 할인 혜,0
664,2020 수능 끝②먹고 꾸미고 즐기자’외식·패션 업계 할인에 쿠폰까지,0
665,혼족어플 한국의 매운음식 톱7은 ?매운돈가스 매운짬뽕 낙지볶음 등,0
666,엽떡 먹을 때 코 막히고 콧물 나온다면 당장 병원 가봐야 한다,0
667,김한슬 치어리더의 고백 키스타임에 연인들이 부러워요 서정환의 사심인터,0
668,치킨 제대로 먹으려면,0
669,마켓컬리에서 구입한 카레에서 녹슨 나사가 나왔어요”,0
670,김한슬 치어리더의 고백 키스타임에 연인들이 부러워요 서정환의 사심인터,0
671,치킨 제대로 먹으려면,0
672,마켓컬리에서 구입한 카레에서 녹슨 나사가 나왔어요”,0
673,막걸리 23종 상표 떼고 맞붙었다 전문가들이 뽑은 1위는,1
674,엽떡·닭발처럼 혀 불바다 만드는 음식 미친 듯이 당기면 스트레스 폭발 ,0
675,이서우의 Pick味 중국당면 열풍···2㎜부터 3㎝까지 면 사리’ 강자는,1
676,엽떡 5천원 할인 받는 법 오늘8일부터 12일까지,0
677,카드뉴스 2021년 수능 수험표 할인 혜택은,0
678,상금 천만원 잼라이브 힌트5월 20일 엽떡과 중국OO중국당면 종류는,0
679,오늘12일부터 16일까지 요기요로 엽떡 시키면 무조건 5000원 싸게 먹는다,0
680,오피니언 삶을 사랑해야 한다 도서,0
681,잼라이브 힌트 엽떡과 중국 OO 정답 무엇,0
682,톱스타 리턴즈 신개념 자이로드롭 자기PR 스피드 출신 박서안 정산금액은,0
683,엽떡 할인 쿠폰 프로모션 시작 이용자 몰리며 앱 연결 지연,0
684,왜 우리는 불닭볶음면’과 디진다 돈까스’에 열광할까,0
685,SPO합니다브람스 이지원 오래 행복하게 연기하고 싶어요,0
686,스마트 1분 상식 가장 비싼 프랜차이즈 음식 TOP 5,0
687,시험 끝나고 친구들과 와구와구 퍼먹으면 스트레스 한방에 풀리는 엽떡볶음밥,0
688,엽떡 베이컨 토핑보다 더 미친 중독성 자랑하는 맵짠맵짠 스팸토핑,0
689,써브웨이 버거킹 맘스터치 등 유명 프랜차이즈 업소 식품위생법 위반,-1
690,시험 끝나고 친구들과 와구와구 퍼먹으면 스트레스 한방에 풀리는 엽떡볶음밥,0
691,엽떡 베이컨 토핑보다 더 미친 중독성 자랑하는 맵짠맵짠 스팸토핑,0
692,써브웨이 버거킹 맘스터치 등 유명 프랜차이즈 업소 식품위생법 위반,-1
693,잘 지은 이름 덕분에 광고까지 따낸 스타 5인,0
694,전문가 칼럼 2019년 창업트렌드 유행 덜 타는 인생 창업 아이템,1
695,대세예보 먹방 대세 슈기 많이 먹는 묘기를 넘어함께 먹어 행복한 먹방,1
696,bbq 등 K프랜차이즈 베트남서 女心 공략여성의 날 프로모션 눈길,0
697,KLPGA 메이저 KB금융 스타챔피언십 미디어데이 시시콜콜 일문일답,0
698,샤이니 응원 속 키KEY 웰컴백→이제 기범이 하고 싶은거 다해 ft나혼산,0
699,샤이니 키 전역 하루 만에 컴백‥軍선임 BTB 창섭도 깜짝 등장 V라이브,0
700,오마이걸 효정 마가렛트 크림치즈 케이크 레시피,0
701,임영웅 내세운 티바두마리 언급량 30배 급증 1위 교촌 넘었다,1
702,온천1동 행복나눔복지회 안경 지원 外,0
703,안락2동 추석맞이 어려운 이웃을 위한 따뜻한 손길 이어져,0
704,홈밥족들 위한 다양한 집콕 메뉴 찾아보니,0
705,온천2동 온천2구역재개발정비사업조합 추석맞이 취약계층 쌀 지원 外,-1
706,안락2동 온정나눔가게 현판 제작·부착,0
707,가래떡 같은 中 당면 식감 한번 기똥차네,0
708,끝나지 않는 코로나19식품·외식업계 다양한 집콕 메뉴 내놨다,0
709,다시 시작된 코로나19식품외식업계 홈밥족 위한 다양한 메뉴 출시,1
710,외식업계 홈밥족들 위한 다양한 집콕 메뉴 출시,1
711,아인 가수 안됐으면 스트릿 댄서 했을 것” M사소한인터뷰일급비밀편③,0
712,김새론 악뮤 수현과 절친 김유정이 연결,0
713,카드뉴스 먹방유튜버 추천 음식 꿀조합 맛있는 음식 조합,0
714,자막 편집까지” 철구가 진행한 먹방 문복희 제대로 저격했다 영상,0
715,찬바람 불면 호빵,0
716,직원 반말 항의한 고객에 매장 이용 어렵다’고 한 엽떡진심어린 사과”,-1
717,빨간날 여성에겐 반말로 성별 따라 다르게 대하세요,0
718,핫클립강유미의 좋아서 하는 유튜브,0
719,고현준의 뉴스딱 민망한 장면 가득유튜브 게임 광고 논란,-1
720,고현준의 뉴스딱 민망한 장면 가득유튜브 게임 광고 논란,-1
721,종합랜선라이프 종현X대도서관의 설레는 브로♥ 윰댕 의문의 1패,0
722,자취생이라면 꼭 알아야 할 배달 음식 꿀조합 7가지,0
723,상식을 깨는 다이어트 유튜버 3,0
724,영상 중국당면 로제파스타 넙적당면 맛있게먹는법 초거대 로제파스타,0
725,MZ세대 노려라 식품업계 이색 마케팅 열풍,1
726,잠 못 드는 밤을 함께해줄 야식 친구’,0
727,영상 초간단 육회만들기 자취요리 가성비 끝판왕 육회레시피,0
728,빨간 맛’ 톡톡스트레스 한국인 입안 혁명을 원해요”,0
729,ESC 그가 퇴사한 이유,0
730,외식업계 치즈로 꽉꽉 채워 쭉쭉 늘어나는 고객 인기,1
731,외식업계 돌아온 치즈 트렌드 신메뉴 쏟아진다,1
732,매운 음식 먹을 때 유산균 음료는 필수죠,0
733,스트레스 해소엔 매운맛’ · 단맛’이 최고,1
734,메르세데스벤츠 아우디 포르쉐가 내놓은 신차,0
735,꼰대인턴 박해진 라면 먹방에 항상 진심찐이기에 가능,0
736,쿨피스 콸콸 들이부어도 소용없는 매운맛 6대 천왕,0
737,치즈와 진한 케미 자랑하는 빨간맛 음식 BEST 6,0
738,DA인터뷰 김명선 치킨 먹다 잠들던 102kg의 나 살기 위해 다이어트”,0
739,2017 더피알 광고모델 어워즈 ⓛ 싱크로율 100상,0
740,2017 더피알 광고모델 어워즈 ⓛ 싱크로율 100상,0
741,분식도 이제는 프리미엄Smile 75,0
742,매운맛 좀 볼래’,0
743,강남구 60세 여성 교인 58세 해외근무자 등 2명 양성 판정,0
744,물류센터發 코로나19 확산에 배달음식 시장도 움찔,0
745,강남구 삼성서울병원 추가확진 無본관 수술장 운영재개,0
746,코로나19 통합뉴스룸 서울 확진자 7명 추가확인이태원 클럽발 감염 5명 ,0
747,개그콘서트’ 김대희 코주부 변신택배 얼굴로 받는 슈트맨 폭소’종,0
748,하루에만 재난문자 20건코나로19 검사 받으세요,0
749,속보 인천시 중구청 코로나19 678번 확진자 동선 정보 공개,0
750,클럽발 감염 5명 등 오늘 서울 확진자 7명 추가확인,0
751,강남구 삼성서울병원 코로나19 추가 확진자 나오지 않아,0
752,개그콘서트’ 김대희 코주부 변신택배 얼굴로 받는 슈트맨 폭소’종,0
753,하루에만 재난문자 20건코나로19 검사 받으세요,0
754,속보 인천시 중구청 코로나19 678번 확진자 동선 정보 공개,0
755,같은 티켓값 그러나 여운은 길다”모래시계’의 이유있는 자신감 종합,0
756,보기만 해도 군침이 싹 스타가 소개하는 야식 3선,0
757,미슐랭 오른 숯불향 맛보고 싶다면 인생의 매운맛이 필요하다면 바닷바람,0
758,인천시민 감염병과의 전쟁 응원합니다,0
759,어게인TV편털’ EXID 하니 동생 보는 맘이 이렇죠ft우쭈쭈,0
760,보기만 해도 군침이 싹 스타가 소개하는 야식 3선,0
761,미슐랭 오른 숯불향 맛보고 싶다면 인생의 매운맛이 필요하다면 바닷바람,0
762,인천시민 감염병과의 전쟁 응원합니다,0
763,어게인TV편털’ EXID 하니 동생 보는 맘이 이렇죠ft우쭈쭈,0
764,배민 수수료 개편 논란배민 배달 장사하는 사람 전부 죽인다,-1
765,서초구청 3월 21일 귀국한 확진자 마트·부동산 등 방문,0
766,서민에게 점점 멀어지는 서민 음식 TOP 5,0
767,식약처 배달음식점·온라인 반찬가게 등 위생기준 위반업체 40곳 적발,-1
768,경주 코로나 40번 41번 확진자 동선 확인,0
769,코로나19경주시 추가 확진 40번 동선조개구이·미용실·회센터·제과점·,0
770,경주서 코로나19 확진 4명 추가41명으로 늘어나,0
771,코로나19 경주시 단란주점 38번 확진자 여동생 확진증상은 언니보다 먼저,0
772,경주 코로나 39번 확진자 동선 확인,0
773,경북 경주시 코로나19 2명 추가 확진총 41명으로 늘어,0
774,아 매워 매워 매워 한국인들 매운맛에 푹 빠졌다,0
775,더위엔 이열치열카레·짬뽕·불맛 등 매운맛에 푹 빠진 식품업계,0
776,식품시장 매운맛에 푹 빠져들다,0
777,확진자 동선 서산시 코로나19 3번8번 확진자 이동경로,0
778,서산시청 코로나 38번 확진자 동선 공개시내 곳곳 활보·2명은 역학조사 ,0
779,마포구 성산1동 거주 코로나 확진자 추가타구 거주자 동선 상암점 엽떡·타,0
780,식품업계 스트레스 날리고 입맛UP 매운맛 열풍,1
781,확진자 동선 서산시 코로나19 3번8번 확진자 이동경로,0
782,서산시청 코로나 38번 확진자 동선 공개시내 곳곳 활보·2명은 역학조사 ,0
783,마포구 성산1동 거주 코로나 확진자 추가타구 거주자 동선 상암점 엽떡·타,0
784,Consumer Journal 辛맛에 빠진 대한민국,0
785,대동맛지도 순하게 넉넉하게 이대 맛집 산타비’  ①,1
786,H매거진 2020년 건강하려면 버릴 20가지,0
787,2020 대한민국을 빛낼 인물·브랜드대상 성황리 열려,0
788,2020 대한민국을 빛낼 인물·브랜드대상’ 프레스센터에서 열려,0
789,외동으로 자란 두 사람의 의기투합 아들딸 셋 낳고 대가족 꿈 이뤘죠,0
790,2020 대한민국을 빛낼 인물·브랜드대상’ 성료,0
791,외동으로 자란 두 사람의 의기투합 아들딸 셋 낳고 대가족 꿈 이뤘죠,0
792,690만원만 있으면 소자본창업이 가능,0
793,런닝맨 김세정 예능 다크호스란 이런 것유재석 머리에 박 와장창,0
794,빅버스 지방에 사는 학생들은 서울에 대해 얼마나 알까,0
795,2020학년도 수험생 할인에 주목 영화·놀이공원·외식 등 수험표 할인 총정,1
796,뼈 빠지게 고생한 수험생들이 수험표 하나로 받을 수 있는 역대급 할인 총,0
797,쫀득한 찹쌀 만두피 안에 치즈 듬뿍 들어가 치즈볼보다 10배 맛있다는 모짜,0
798,생방송투데이리얼맛집 원주 이동식 18솥뚜껑닭볶음탕 식당 위치는 묵은지,1
799,낯선 맛 괴식 온라인서 열광하자 산업으로 진화,1
800,낯선 맛 괴식 온라인서 열광하자 산업으로 진화,1
801,우먼 동아일보 남궁민 리얼’과 연기 사이에서 어느덧 정상에 오른 배우,0
802,괴식怪食의 현재와 미래 낯선 맛에 열광하자 산업으로 진화괴식은 혁,1
803,2019 제14회 대한민국 문화경영대상’ 프레스센터에서 열려,0
804,수험생 할인 AZIT가전에 네일숍까지 큰손 모셔라,0
805,2020 수능 테마파크부터 공연장까지수험생 위한 할인 이벤트 풍성,0
806,국가비와 열애 조쉬 캐럿 친구 조니와 엽떡 도전 표정에서 느껴지네,0
807,과학을 품은 뉴스 스트레스 받을 때 매운맛이 당기는 이유,0
808, Consumer 어 왜 이렇게 조금이지” 양심 빼먹는 음식배달,0
809,매운음식 좋아하는 외국인 제시 데이가 먹어본 11가지,0
810,저렴한 한끼김밥 공식 안 통해 브랜드화 열풍에 서민 부담 커져,1
811,전국에서 매운 음식 가장 잘 먹는 맵고수를 찾습니다,0
812,땀과 눈물 없이는 먹을 수 없는,-1
813,마라탕·국물 닭발 매운 음식 먹고 아이스 아메리카노 마시면 위에 구멍 ,0
814,신상 뜯어보기불닭·엽떡보다 맵다닭다리 사이에 스며든 헬게이트 매운,-1
815,나에게 필요한 ○세권,0
816,가을철 건강 주의보 낮에는 덥고 밤에는 춥고,0
817,SPECIAL REPORT 2 프랜차이즈 폐점률’ 천차만별,-1
818,음식의 이색 콜라보레이션 열풍 식품·외식 업계 메뉴 구성에도 영향,1
819,구찌처럼젊은 직원에게 한 수 배운다,0
820,음식의 이색 콜라보레이션 열풍 식품·외식 업계 메뉴 구성에도 영향,1
821,구찌처럼젊은 직원에게 한 수 배운다,0
822,안락2동 맛있는 나눔？사랑의 반찬 지원사업 추진,0
823,Opinion 마라탕 유행으로 추억이 된 마라 체험기 문화 전반,0
824,오늘2일 요기요서 엽떡배라 주문하면 최대 1만원 할인,0
825,이거 실화예요” 경북의 한 여자고등학교 급식실에서 발생한 참사,0
826,창업 뉴 트렌드 스트레스 싹 날리는 매운맛불황 몰라요,1
827,쌀국수 위에 곱창 한가득 들이부어 걸쭉한 국물이 끝장나는 매콤 폭발 곱창 ,0
828,인서울 민도희 려운과 썸수시 탈락에 오열→드디어 수능 Dday 종합,0
829,몬스터김 1차 완판 후 2차 재입고 개시맵부심 부리다가 큰 코 다쳐,0
830,희망으로 짓는 꿈터 이야기,0
831,매일 삽질 매운맛 고수 혜린을 KO시킨 매운 음식 최강자는,0
832,물만 마셔도 살찐다는 친구들의 반박불가 특징 6가지,0
833,맛있는 수다2 매력적인 미모의 여성CEO 특집 2편,0
834,맛있는 수다2 매력적인 미모의 여성CEO 특집 2편,0
835,맛있는 수다 매력적인 미모의 여성CEO 특집 1편,0
836,한국 매운 음식 5 일반적 돈가스가 1위3500명 중 90명만 성공,1
837,부산의 매운맛을 찾아서 Soooo Hot 식신로드 1탄,0
838,엽떡 이벤트에 모바일 앱 접속자 폭주선착순 14000원 쿠폰,0
839,오늘8일부터 12일까지 요기요로 엽떡 주문하면 무조건 5천원 싸게 먹을 수,0
840,한국 매운 음식 5 일반적 돈가스가 1위3500명 중 90명만 성공,1
841,부산의 매운맛을 찾아서 Soooo Hot 식신로드 1탄,0
842,엽떡 이벤트에 모바일 앱 접속자 폭주선착순 14000원 쿠폰,0
843,오늘8일부터 12일까지 요기요로 엽떡 주문하면 무조건 5천원 싸게 먹을 수,0
844,매운 음식 먹고 속 불편했던 날들 이젠 안녕,0
845,엽떡도 반한  중국 당면  불리기 방법과 냉동 보관법 및  중국 당면 찜닭,0
846,D스토리 마라 불닭볶음면빨간 맛의 비밀,0
847,매운 음식 못 먹는 게 그렇게 놀랄 일인가요···맵찔이는 폭풍 공감하는,0
848,CNN 한국에서 가장 매운 음식 5가지 소개1위는,1
849,분식점 프랜차이즈 특색 있는 메뉴로 경쟁한다,0
850,CNN 선정 한국에서 가장 매운 5가지 음식은,0
851,분식점 프랜차이즈 특색 있는 메뉴로 경쟁한다,0
852,오늘27일부터 31일까지 요기요로 엽떡 주문하면 무조건 5천원 싸게 먹을 ,0
853,몸이 멀어지면 마음도 멀어진다는 말 무효 만드는 롱디커플 남친의 사랑,0
854,정상화 나선 지 두 시간 흘렀지만여전히 눈물 흘리는 엽떡,-1
855,잼라이브 오늘의 힌트 5월 12일 일 아버지를 아버지라 부르지 못 하고 정,0
856,종영모두의 주방 강호동→사쿠라 진정성으로 완성한 힐링시즌2 기대감,0
857,모두의주방 청하X사쿠라 프로듀스 선후배의 훈훈한 만남 전일야화,0
858,모두의 주방 사쿠라 1위 트로피 안고 도착 함께 즐거운 식사 시즌1 마무리,1
859,모두의 주방’ 청하 떡볶음탕 롤러코스터’처럼 아찔한 맛”,0
860,모두의 주방’ 청하 떡볶음탕 롤러코스터’처럼 아찔한 맛”,0
861,포인트1분모두의 주방 강호동 시즌1 마지막화를 기념하며 케이크 라자냐,0
862,모두의 주방 이루마X청하와 함께한 시즌 1 마지막 식사종합,0
863,엘솔컴퍼니 맛셔틀’ 출범스튜디오 tap운영 본격화,0
864,시험 끝나고 친구들이랑 도장 깨기 하러 가야 할 스트레스 확 풀리는 음식 6가,0
865,대장균 검출부터 유통기한 경과까지맘스터치 등 식품위생 미흡 업소 무더기,0
866,인터뷰 네온 유키카 바다를 건너 온 21세기의 책받침 여신 종합,0
867,UCC세상 ㅋㅋㅋ유머 재미있는 가게 이름 外,0
868,시너지 컨설케이션유튜브마케팅 먹방과 배달로 연결되어지는 컨셉 방송이 ,0
869,월급루팡 네온 유키카 인터뷰 도중 깜짝 놀라게 만든 발언 다섯 가지,0
870,기념일 날 선물하면 누구에게나 사랑♥ 듬뿍 받을 신박 케이크 7,0
871,제2회 두류국제록페스티발,0
872,두 남자의 곁엔 항상 음악이 있고 항상 서로가 있다,0
873,공복자들’ 권다현 시각청각 능력자이걸 어떻게 알았어”,0
874,잇츠스킨·카페베네·파파이스10곳 중 2곳 넘게 문 닫았다,0
875,인스타그램 인기 작가 오늘의 다은 매일 그림일기 『오늘의 다은,1
876,스코빌 10000 유튜버들의 핵불닭볶음면 도전기,0
877,cooking 매운맛 좀 보세요,0
878,추워도 끼니 걱정 No 대안은 배달음식,0
879,신동엽 2018 대한민국광고대상 광고인이 뽑은 최고의 광고모델 수상 영예,1
880,스코빌 10000 유튜버들의 핵불닭볶음면 도전기,0
881,cooking 매운맛 좀 보세요,0
882,추워도 끼니 걱정 No 대안은 배달음식,0
883,신동엽 2018 대한민국광고대상 광고인이 뽑은 최고의 광고모델 수상 영예,1
884,아는형님 김새론·수현·이상엽·온주완의외의 절친 色다른 웃음종합,0
885,아는형님 김새론 악뮤 수현과 절친김유정이 연결해줘,0
886,진짜 김치 사러 갔다가 신세계에 빠졌다,0
887,박성연 날 한마디로 표현하자면 엔돌핀” M사소한인터뷰,0
888,유튜브를 여행하는 히치유튜버를 위한 안내서,0
889,폐점률 높은 프랜차이즈 보니 잇츠스킨·그램그램,-1
890,신동엽 2018 대한민국광고대상 광고인이 뽑은 최고의 광고모델상 수상,1
891,아는형님 김새론·수현·이상엽·온주완의외의 절친 色다른 웃음종합,0
892,아는형님 김새론 악뮤 수현과 절친김유정이 연결해줘,0
893,진짜 김치 사러 갔다가 신세계에 빠졌다,0
894,박성연 날 한마디로 표현하자면 엔돌핀” M사소한인터뷰,0
895,유튜브를 여행하는 히치유튜버를 위한 안내서,0
896,폐점률 높은 프랜차이즈 보니 잇츠스킨·그램그램,-1
897,밴쯔가 29살 생일상으로 선택한 역대급 음식 클라스,0
898,영상 오늘 뭐먹지 랜덤 음식 뽑기 점심메뉴 추천,0
899,어게인TV 랜선 라이프 뉴이스트W 종현 대도서관의 성공한 덕후ft 주거,0
900,프랜차이즈 가맹점 폐점률 10 최다 브랜드 잇츠스킨폐점률 0 브랜드,-1
901,밴쯔가 29살 생일상으로 선택한 역대급 음식 클라스,0
902,영상 오늘 뭐먹지 랜덤 음식 뽑기 점심메뉴 추천,0
903,어게인TV 랜선 라이프 뉴이스트W 종현 대도서관의 성공한 덕후ft 주거,0
904,19살 동갑내기 반란 영미를 집으로 보내다,0
905,영상 연어덕후 주목 밥 한공기 순삭하는 존맛탱 연어장 만들기,1
906,코하쿠토 만들기 코하쿠토 ASMR 영롱뽀짝 유리조각 코하쿠토,0
907,오늘의 핫클릭 심진화 김원효가 결혼 전 1억 있다고 거짓말 파혼할 뻔”,1
908,20대 건강 괴담,0
909,잊을 수 없는 축제의 맛,0
910,어게인TV 랜선 라이프 뉴이스트W 종현 대도서관의 성공한 덕후ft 주거,0
911,19살 동갑내기 반란 영미를 집으로 보내다,0
912,영상 연어덕후 주목 밥 한공기 순삭하는 존맛탱 연어장 만들기,1
913,코하쿠토 만들기 코하쿠토 ASMR 영롱뽀짝 유리조각 코하쿠토,0
914,오늘의 핫클릭 심진화 김원효가 결혼 전 1억 있다고 거짓말 파혼할 뻔”,1
915,20대 건강 괴담,0
916,잊을 수 없는 축제의 맛,0
917,입안이 화끈 자꾸만 생각나는 매운맛,0
918,한국어 배우다 한국 매력에 빠졌어요”,0
919,노기자의 I LOVE SCHOOL 농구 코트의 미스 유니버스 연세대 MissB,0
920,노기자의 I LOVE SCHOOL 농구 코트의 미스 유니버스 연세대 MissB,0
921,어저께TV아형 백종원바라기 소유진X대한가나인 샘오취리 ♡꾼들,0
